{
  "source_path": "AI/Roundup/2026-10-18 - Live33 Weekly Rundown.md",
  "is_final": false,
  "parts": [
    {
      "id": "0",
      "sort_key": 0.0,
      "is_numbered": true,
      "title": "인트로",
      "time_raw": "5분",
      "time_minutes": 5,
      "is_remainder": false,
      "coverage_state": "defined",
      "coverage_items": [
        "서른세 번째 방송 · 오늘의 주제",
        "Muse 가 메인이고 나머지는 우선순위로 진행한다는 예고"
      ],
      "directive_note": null
    },
    {
      "id": "1",
      "sort_key": 1.0,
      "is_numbered": true,
      "title": "Muse 를 나의 Workflow 에 맞게 — 오늘의 메인",
      "time_raw": "분 수 미정",
      "time_minutes": null,
      "is_remainder": false,
      "coverage_state": "defined",
      "coverage_items": [
        "Muse 로 할 수 있는 일과 내 일에 맞는 일 나누기",
        "Muse 결과를 내 컴퓨터의 2nd Brain 으로 옮기기",
        "Muse 에서 VibeLearn AI 방식으로 일할 수 있는지"
      ],
      "directive_note": null
    },
    {
      "id": "2",
      "sort_key": 2.0,
      "is_numbered": true,
      "title": "Seattle AI Week 행사 리서치",
      "time_raw": "분 수 미정",
      "time_minutes": null,
      "is_remainder": false,
      "coverage_state": "defined",
      "coverage_items": [
        "Seattle AI Week 행사를 AI 로 모아 정리하기",
        "배우고 싶은 것을 기준으로 참가할 행사 고르기"
      ],
      "directive_note": null
    },
    {
      "id": "3",
      "sort_key": 3.0,
      "is_numbered": true,
      "title": "AI 영상 제작 지원 방법 조사",
      "time_raw": "분 수 미정",
      "time_minutes": null,
      "is_remainder": false,
      "coverage_state": "defined",
      "coverage_items": [
        "긴 행사 영상을 AI 로 짧은 하이라이트로 만드는 방법 비교",
        "인트로 · 효과를 넣는 방법"
      ],
      "directive_note": null
    },
    {
      "id": "4",
      "sort_key": 4.0,
      "is_numbered": true,
      "title": "AI 시대 새 마켓과 빌더의 대응",
      "time_raw": "분 수 미정",
      "time_minutes": null,
      "is_remainder": false,
      "coverage_state": "defined",
      "coverage_items": [
        "AI 로 누구나 만들 수 있게 되면 만든 것의 가치는 어디로 가나",
        "빌더는 무엇을 준비해야 하나"
      ],
      "directive_note": null
    },
    {
      "id": "5",
      "sort_key": 5.0,
      "is_numbered": true,
      "title": "밀린 작업 실험 — 시간이 되는 만큼",
      "time_raw": "분 수 미정",
      "time_minutes": null,
      "is_remainder": false,
      "coverage_state": "undefined",
      "coverage_items": [],
      "directive_note": null
    },
    {
      "id": "6",
      "sort_key": 6.0,
      "is_numbered": true,
      "title": "마무리 — 다음 주 예고",
      "time_raw": "분 수 미정",
      "time_minutes": null,
      "is_remainder": false,
      "coverage_state": "defined",
      "coverage_items": [
        "다음 주 예고 · 끝인사",
        "11/1 부터 방송 시각 변경 안내"
      ],
      "directive_note": null
    },
    {
      "id": "틈새 A: 이번 주 만든 콘텐츠",
      "sort_key": 907.0,
      "is_numbered": false,
      "title": "틈새 A: 이번 주 만든 콘텐츠",
      "time_raw": "시간이 남으면",
      "time_minutes": null,
      "is_remainder": false,
      "coverage_state": "defined",
      "coverage_items": [
        "Builders Lounge 의 AI 친구 @Bila AI 소개 영상"
      ],
      "directive_note": null
    },
    {
      "id": "틈새 B: 이번 주 소식 · 인사이트",
      "sort_key": 908.0,
      "is_numbered": false,
      "title": "틈새 B: 이번 주 소식 · 인사이트",
      "time_raw": "시간이 남으면",
      "time_minutes": null,
      "is_remainder": false,
      "coverage_state": "defined",
      "coverage_items": [
        "Civic Innovation Challenge Topic 진행"
      ],
      "directive_note": null
    },
    {
      "id": "주간 영상",
      "sort_key": 909.0,
      "is_numbered": false,
      "title": "주간 영상",
      "time_raw": "Optional — 선택 코너",
      "time_minutes": null,
      "is_remainder": false,
      "coverage_state": "undefined",
      "coverage_items": [],
      "directive_note": null
    }
  ],
  "excluded_sections": [
    {
      "heading": "실험 후보 (확정 아님)",
      "reason": "candidate"
    }
  ],
  "conditional_sections": [],
  "parse_anomalies": [],
  "parsed_at": "2026-10-25T08:34:43.693212+00:00",
  "frontmatter_status": "draft"
}
