{
  "source_path": "AI/Roundup/2026-05-26 - Live12 Weekly Rundown.md",
  "is_final": false,
  "parts": [
    {
      "id": "1",
      "sort_key": 1.0,
      "is_numbered": true,
      "title": "지난 주 활동",
      "time_raw": "시간 미표기",
      "time_minutes": null,
      "is_remainder": false,
      "coverage_state": "undefined",
      "coverage_items": [],
      "directive_note": null
    },
    {
      "id": "2",
      "sort_key": 2.0,
      "is_numbered": true,
      "title": "내 주변 AI 뉴스 — CMDS x GOBI Cohort 1기 W5",
      "time_raw": "시간 미표기",
      "time_minutes": null,
      "is_remainder": false,
      "coverage_state": "undefined",
      "coverage_items": [],
      "directive_note": null
    },
    {
      "id": "3",
      "sort_key": 3.0,
      "is_numbered": true,
      "title": "Qwen3-TTS Voice Clone 튜닝 결과",
      "time_raw": "시간 미표기",
      "time_minutes": null,
      "is_remainder": false,
      "coverage_state": "undefined",
      "coverage_items": [],
      "directive_note": null
    },
    {
      "id": "4",
      "sort_key": 4.0,
      "is_numbered": true,
      "title": "Builders Lounge 2차 모임 & GobiSpace AI 구상",
      "time_raw": "시간 미표기",
      "time_minutes": null,
      "is_remainder": false,
      "coverage_state": "undefined",
      "coverage_items": [],
      "directive_note": null
    },
    {
      "id": "6",
      "sort_key": 6.0,
      "is_numbered": true,
      "title": "라이브 실험 — Catch Up AI 홈피 업데이트",
      "time_raw": "시간 미표기",
      "time_minutes": null,
      "is_remainder": false,
      "coverage_state": "undefined",
      "coverage_items": [],
      "directive_note": null
    },
    {
      "id": "7",
      "sort_key": 7.0,
      "is_numbered": true,
      "title": "라이브 실험 — 미국 녹화·녹음 법률 규정 학습",
      "time_raw": "시간 미표기",
      "time_minutes": null,
      "is_remainder": false,
      "coverage_state": "undefined",
      "coverage_items": [],
      "directive_note": null
    },
    {
      "id": "8",
      "sort_key": 8.0,
      "is_numbered": true,
      "title": "라이브 실험 — GobiSpace 커스텀 홈피 작업",
      "time_raw": "시간 미표기",
      "time_minutes": null,
      "is_remainder": false,
      "coverage_state": "undefined",
      "coverage_items": [],
      "directive_note": null
    }
  ],
  "excluded_sections": [],
  "conditional_sections": [],
  "parse_anomalies": [],
  "parsed_at": "2026-09-17T15:05:56.981010+00:00"
}
