{
  "source_path": "AI/Roundup/2026-09-06 - Live27 Weekly Rundown.md",
  "is_final": true,
  "parts": [
    {
      "id": "1",
      "sort_key": 1.0,
      "is_numbered": true,
      "title": "지난 주 생성한 컨텐츠",
      "time_raw": "시간 미표기",
      "time_minutes": null,
      "is_remainder": false,
      "coverage_state": "defined",
      "coverage_items": [
        "Caregiver 캡스톤 영상 「요양보호사, 마음만 먹으면 당장 취업됩니다」(한/영)"
      ],
      "directive_note": null
    },
    {
      "id": "2",
      "sort_key": 2.0,
      "is_numbered": true,
      "title": "오늘의 실험",
      "time_raw": "시간 미표기",
      "time_minutes": null,
      "is_remainder": false,
      "coverage_state": "defined",
      "coverage_items": [
        "AI로 라이브 방송 보조 MC 앱 만들기 마무리",
        "Claude Artifacts & Routines 배우기",
        "AI로 Seattle AI Week 참가 준비하기"
      ],
      "directive_note": null
    },
    {
      "id": "주간 영상",
      "sort_key": 902.0,
      "is_numbered": false,
      "title": "주간 영상",
      "time_raw": "시간 미표기",
      "time_minutes": null,
      "is_remainder": false,
      "coverage_state": "undefined",
      "coverage_items": [],
      "directive_note": null
    }
  ],
  "excluded_sections": [],
  "conditional_sections": [],
  "parse_anomalies": [],
  "parsed_at": "2026-09-17T15:05:57.242949+00:00",
  "frontmatter_status": "✅ 방송 완료 (2026-09-13, Live #27) — 2부 커버리지 3/3 실행, 주간 영상 없음, 방송 후 기록 당일 작성. 1부 ✅ 실행(9/14 사용자 확인) — Rundown 마감"
}
