{
  "source_path": "Ingest/CatchUpAI_VL/Topics/Live-CoMC-App/07-CoMC-Engine-POC/data/rundown_samples/2026-08-02 - Live22 Weekly Rundown.md",
  "is_final": true,
  "parts": [
    {
      "id": "1",
      "sort_key": 1.0,
      "is_numbered": true,
      "title": "지난 주 생성한 콘텐츠",
      "time_raw": "시간 미정",
      "time_minutes": null,
      "is_remainder": false,
      "coverage_state": "defined",
      "coverage_items": [
        "Seattle Tech Week 2026 녹화 영상 편집/업로드 32개 완료",
        "편집 완료 자산을 VibeLearn AI 학습 재료로 전환"
      ],
      "directive_note": null
    },
    {
      "id": "2",
      "sort_key": 2.0,
      "is_numbered": true,
      "title": "오늘의 실험",
      "time_raw": "시간 미정",
      "time_minutes": null,
      "is_remainder": false,
      "coverage_state": "defined",
      "coverage_items": [
        "라이브 방송 보조 MC 앱(Live-CoMC-App M3 완료 + M4 실습 1·2)",
        "Seattle Tech Week 2026 → 기사 작성 Topic 로드맵",
        "VibeLearn AI를 Codex에 최적화"
      ],
      "directive_note": null
    },
    {
      "id": "주간 영상",
      "sort_key": 902.0,
      "is_numbered": false,
      "title": "주간 영상",
      "time_raw": "시간 미정",
      "time_minutes": null,
      "is_remainder": false,
      "coverage_state": "defined",
      "coverage_items": [
        "Seattle Tech Week 2026 녹화 영상 32개 편집/업로드 완료",
        "Live22 준비 완료와 실험 중심 방송 전환"
      ],
      "directive_note": null
    }
  ],
  "excluded_sections": [
    {
      "heading": "보류된 인사이트 후보 (다음 방송 검토용)",
      "reason": "on_hold"
    }
  ],
  "conditional_sections": [],
  "parse_anomalies": [],
  "parsed_at": "2026-09-17T15:05:57.183523+00:00",
  "frontmatter_status": "✅ 방송 완료 (2026-08-09) — 방송 후 실제 진행 일부 반영, 2부 최종 커버리지는 사용자 확인 대기"
}
