{
  "source_path": "AI/Roundup/2026-10-25 - Live34 Weekly Rundown.md",
  "is_final": false,
  "parts": [
    {
      "id": "0",
      "sort_key": 0.0,
      "is_numbered": true,
      "title": "인트로",
      "time_raw": "5분",
      "time_minutes": 5,
      "is_remainder": false,
      "coverage_state": "defined",
      "coverage_items": [
        "서른네 번째 방송 · 시간 변경 안내"
      ],
      "directive_note": null
    },
    {
      "id": "1",
      "sort_key": 1.0,
      "is_numbered": true,
      "title": "오늘의 메인 실험",
      "time_raw": "분 수 미정",
      "time_minutes": null,
      "is_remainder": false,
      "coverage_state": "undefined",
      "coverage_items": [],
      "directive_note": null
    },
    {
      "id": "2",
      "sort_key": 2.0,
      "is_numbered": true,
      "title": "두 번째 실험",
      "time_raw": "분 수 미정",
      "time_minutes": null,
      "is_remainder": false,
      "coverage_state": "undefined",
      "coverage_items": [],
      "directive_note": null
    },
    {
      "id": "3",
      "sort_key": 3.0,
      "is_numbered": true,
      "title": "밀린 작업 실험 — 시간이 되는 만큼",
      "time_raw": "분 수 미정",
      "time_minutes": null,
      "is_remainder": false,
      "coverage_state": "undefined",
      "coverage_items": [],
      "directive_note": null
    },
    {
      "id": "4",
      "sort_key": 4.0,
      "is_numbered": true,
      "title": "마무리 — 다음 주 예고",
      "time_raw": "분 수 미정",
      "time_minutes": null,
      "is_remainder": false,
      "coverage_state": "undefined",
      "coverage_items": [],
      "directive_note": null
    },
    {
      "id": "틈새 A: 이번 주 만든 콘텐츠",
      "sort_key": 905.0,
      "is_numbered": false,
      "title": "틈새 A: 이번 주 만든 콘텐츠",
      "time_raw": "시간이 남으면",
      "time_minutes": null,
      "is_remainder": false,
      "coverage_state": "undefined",
      "coverage_items": [],
      "directive_note": null
    },
    {
      "id": "틈새 B: 이번 주 소식 · 인사이트",
      "sort_key": 906.0,
      "is_numbered": false,
      "title": "틈새 B: 이번 주 소식 · 인사이트",
      "time_raw": "시간이 남으면",
      "time_minutes": null,
      "is_remainder": false,
      "coverage_state": "undefined",
      "coverage_items": [],
      "directive_note": null
    },
    {
      "id": "주간 영상",
      "sort_key": 907.0,
      "is_numbered": false,
      "title": "주간 영상",
      "time_raw": "Optional — 선택 코너",
      "time_minutes": null,
      "is_remainder": false,
      "coverage_state": "undefined",
      "coverage_items": [],
      "directive_note": null
    }
  ],
  "excluded_sections": [],
  "conditional_sections": [],
  "parse_anomalies": [],
  "parsed_at": "2026-10-26T16:10:16.274812+00:00",
  "frontmatter_status": "draft"
}
