{
  "source_path": "AI/Roundup/2026-10-11 - Live32 Weekly Rundown.md",
  "is_final": false,
  "parts": [
    {
      "id": "0",
      "sort_key": 0.0,
      "is_numbered": true,
      "title": "인트로",
      "time_raw": "5분",
      "time_minutes": 5,
      "is_remainder": false,
      "coverage_state": "defined",
      "coverage_items": [
        "서른두 번째 방송 · 오늘의 실험 네 가지 예고"
      ],
      "directive_note": null
    },
    {
      "id": "1",
      "sort_key": 1.0,
      "is_numbered": true,
      "title": "AI 와 함께 하는 온라인 특강 준비",
      "time_raw": "분 수 미정",
      "time_minutes": null,
      "is_remainder": false,
      "coverage_state": "defined",
      "coverage_items": [
        "Builders Lounge 2차 뉴스레터",
        "특강 전에 소개할 Builders Lounge 모임 소개"
      ],
      "directive_note": null
    },
    {
      "id": "2",
      "sort_key": 2.0,
      "is_numbered": true,
      "title": "MS Teams 사용 리허설",
      "time_raw": "약 40분",
      "time_minutes": 40,
      "is_remainder": false,
      "coverage_state": "defined",
      "coverage_items": [
        "1단계 Meeting options 설정 점검과 회의 종료 시각 확정",
        "2단계 로그아웃한 브라우저와 휴대폰으로 참가자 입장 시험(로비)",
        "3단계 화면 공유 · 채팅 · 마이크 시험",
        "4단계 참가자 내보내기 · 회의 종료 시험"
      ],
      "directive_note": null
    },
    {
      "id": "3",
      "sort_key": 3.0,
      "is_numbered": true,
      "title": "Bila AI 기능 소개 · 홍보 영상 준비",
      "time_raw": "35분 안",
      "time_minutes": 35,
      "is_remainder": false,
      "coverage_state": "defined",
      "coverage_items": [
        "1단계 QR 로 Changbal Space 접속 · 처음 가입 · Builders Lounge 채널 등록",
        "2단계 게시판에서 @Bila AI 에게 질문하면 댓글로 답하는 기능 · Bila AI 와 1:1 대화",
        "3단계 GOBI CLI 로 내 컴퓨터의 문서를 게시글로 만들어 올리기"
      ],
      "directive_note": null
    },
    {
      "id": "4",
      "sort_key": 4.0,
      "is_numbered": true,
      "title": "Muse 를 내 Workflow 에 맞추기",
      "time_raw": "분 수 미정",
      "time_minutes": null,
      "is_remainder": false,
      "coverage_state": "defined",
      "coverage_items": [
        "Muse 작업을 내 컴퓨터로 내려받는 방법",
        "Muse 에 VibeLearn AI 를 설치할 수 있는지"
      ],
      "directive_note": null
    },
    {
      "id": "예비 실험",
      "sort_key": 905.0,
      "is_numbered": false,
      "title": "예비 실험",
      "time_raw": "시간이 남으면",
      "time_minutes": null,
      "is_remainder": false,
      "coverage_state": "defined",
      "coverage_items": [
        "시니어를 위한 AI 시스템과 교육 과정 연구",
        "AI 시대 새 마켓과 빌더의 대응 — 발표 자료 준비",
        "Seattle AI Week 준비"
      ],
      "directive_note": null
    },
    {
      "id": "5",
      "sort_key": 5.0,
      "is_numbered": true,
      "title": "마무리 — 수요일 특강 초대",
      "time_raw": "분 수 미정",
      "time_minutes": null,
      "is_remainder": false,
      "coverage_state": "defined",
      "coverage_items": [
        "10/21(수) Builders Lounge 첫 온라인 특강 초대",
        "끝인사"
      ],
      "directive_note": null
    },
    {
      "id": "틈새 A: 이번 주 만든 콘텐츠",
      "sort_key": 907.0,
      "is_numbered": false,
      "title": "틈새 A: 이번 주 만든 콘텐츠",
      "time_raw": "시간이 남으면",
      "time_minutes": null,
      "is_remainder": false,
      "coverage_state": "defined",
      "coverage_items": [
        "시애틀 AI 세미나 100편 인맥 지도"
      ],
      "directive_note": null
    },
    {
      "id": "틈새 B: 이번 주 소식 · 인사이트",
      "sort_key": 908.0,
      "is_numbered": false,
      "title": "틈새 B: 이번 주 소식 · 인사이트",
      "time_raw": "시간이 남으면",
      "time_minutes": null,
      "is_remainder": false,
      "coverage_state": "undefined",
      "coverage_items": [],
      "directive_note": null
    },
    {
      "id": "주간 영상",
      "sort_key": 909.0,
      "is_numbered": false,
      "title": "주간 영상",
      "time_raw": "Optional — 선택 코너",
      "time_minutes": null,
      "is_remainder": false,
      "coverage_state": "defined",
      "coverage_items": [
        "슬라이드 두 번째 장 — 지난주 라이브 리서치로 만든 AI Agent 비교 · Muse 경험 영상 (한국어판 · 영어판)",
        "그 영상을 Remotion AI 로 만든 방법"
      ],
      "directive_note": null
    }
  ],
  "excluded_sections": [
    {
      "heading": "실험 후보 (확정 아님)",
      "reason": "candidate"
    },
    {
      "heading": "방송 전 확인 (이번 방송 미편성)",
      "reason": "unscheduled"
    }
  ],
  "conditional_sections": [],
  "parse_anomalies": [],
  "parsed_at": "2026-10-19T07:05:38.468089+00:00",
  "frontmatter_status": "draft"
}
